{
  "date": "2026-10-11",
  "edition_id": "2026-10-11",
  "generated_at": "2026-10-11T02:20:29+11:00",
  "items": [
    {
      "id": "5a04a5aafd0a8d4e",
      "org": "OpenAI",
      "title_zh": "GPT-6.1 Sol 推出 Ultrafast 极速模式",
      "summary_zh": "OpenAI 为 GPT-6.1 Sol 推出 Ultrafast 模式，已在 API、Codex 和 ChatGPT Work 上线。官方称其智能水平接近 Astra，速度最高可达 Sol 标准版的 8 倍。",
      "source_url": "https://x.com/OpenAIDevs/status/2108262812489531498",
      "posted_at": "2026-10-08T18:26:38Z"
    },
    {
      "id": "602ca56ee63dd8a0",
      "org": "Anthropic",
      "title_zh": "Anthropic 将定期公开模型行为报告",
      "summary_zh": "Anthropic 宣布在系统卡和风险报告之外，更频繁地发布模型行为报告。首份报告介绍了在评估和内部使用中发现的四类 Claude 行为。",
      "source_url": "https://x.com/AnthropicAI/status/2108680150556737819",
      "posted_at": "2026-10-09T22:04:59Z"
    },
    {
      "id": "37ff23c180d0ce88",
      "org": "Google DeepMind",
      "title_zh": "医疗对话 AI AMIE 研究登上《柳叶刀》",
      "summary_zh": "谷歌 AMIE 完成首个患者端对话式诊断的真实诊所前瞻性研究：患者就诊前先与 AI 对话整理病史。98 名真实就诊患者中，其鉴别诊断列表 90% 包含正确诊断。",
      "source_url": "https://x.com/sundarpichai/status/2108329198955958339",
      "posted_at": "2026-10-08T22:50:26Z"
    },
    {
      "id": "511d62e556960a4e",
      "org": "OpenAI",
      "title_zh": "Codex 上线「下一条消息预测」测试版",
      "summary_zh": "OpenAI 面向 Pro 用户推出 Codex composer predictions 测试版，可根据对话内容和你的表达习惯，预测并建议你要发的下一条消息。",
      "source_url": "https://x.com/OpenAIDevs/status/2108624138369929725",
      "posted_at": "2026-10-09T18:22:25Z"
    },
    {
      "id": "30b01d0f9eadaacc",
      "org": "NVIDIA",
      "title_zh": "黄仁勋获颁美国国家科学奖章",
      "summary_zh": "NVIDIA CEO 黄仁勋因推动 GPU 计算、助力科学突破，获颁美国国家科学奖章；同批获奖者还有马斯克、苏姿丰、戴尔、纳德拉和布林。",
      "source_url": "https://x.com/nvidia/status/2108291409623314770",
      "posted_at": "2026-10-08T20:20:16Z"
    }
  ],
  "message_text": "Builder Space 每日 AI 速递 · 10月11日\n\n1. 【OpenAI】GPT-6.1 Sol 推出 Ultrafast 极速模式\nOpenAI 为 GPT-6.1 Sol 推出 Ultrafast 模式，已在 API、Codex 和 ChatGPT Work 上线。官方称其智能水平接近 Astra，速度最高可达 Sol 标准版的 8 倍。\n原文：https://x.com/OpenAIDevs/status/2108262812489531498\n\n2. 【Anthropic】Anthropic 将定期公开模型行为报告\nAnthropic 宣布在系统卡和风险报告之外，更频繁地发布模型行为报告。首份报告介绍了在评估和内部使用中发现的四类 Claude 行为。\n原文：https://x.com/AnthropicAI/status/2108680150556737819\n\n3. 【Google DeepMind】医疗对话 AI AMIE 研究登上《柳叶刀》\n谷歌 AMIE 完成首个患者端对话式诊断的真实诊所前瞻性研究：患者就诊前先与 AI 对话整理病史。98 名真实就诊患者中，其鉴别诊断列表 90% 包含正确诊断。\n原文：https://x.com/sundarpichai/status/2108329198955958339\n\n4. 【OpenAI】Codex 上线「下一条消息预测」测试版\nOpenAI 面向 Pro 用户推出 Codex composer predictions 测试版，可根据对话内容和你的表达习惯，预测并建议你要发的下一条消息。\n原文：https://x.com/OpenAIDevs/status/2108624138369929725\n\n5. 【NVIDIA】黄仁勋获颁美国国家科学奖章\nNVIDIA CEO 黄仁勋因推动 GPU 计算、助力科学突破，获颁美国国家科学奖章；同批获奖者还有马斯克、苏姿丰、戴尔、纳德拉和布林。\n原文：https://x.com/nvidia/status/2108291409623314770\n\n—— 由 Builder Space Bot 自动整理自 X 公开动态，仅供参考，请以原文为准。",
  "content_sha256": "9dfe32b7689be841ef6534756bf074aa9a28e4eb57102898c9bfdbb44e62706b"
}
